{
  "attribution": [
    {
      "method": "cortex.formal.z3",
      "role": "final_answer",
      "uncertainty": "low"
    },
    {
      "method": "cortex.verifier.adversarial",
      "role": "flaw_detection",
      "uncertainty": "medium"
    }
  ],
  "authorization_ref": null,
  "competence_update": {
    "after": 0.7778,
    "before": 0.5,
    "bounded": true,
    "changes": "ordering among eligible routes only",
    "delta": 0.2778,
    "weight": 1.0
  },
  "conditions": [],
  "consequence_class": "internal_write",
  "geometry": "constraint_feasibility",
  "method": "cortex.formal.z3",
  "method_version": "0.2.0",
  "outcome_provenance": {
    "kind": "external_observation",
    "ref": "example: schedule executed as proved",
    "validation_status": "externally_verified"
  },
  "outcome_status": "verified_success",
  "policy_version": "cortex-route-policy/0.1",
  "problem_id": "H-F01",
  "receipt_id": "sha256:75d8166fb0c7c139c6f043a29cd2f3140a04807241348926d6ec626102513acc",
  "recommendation": "recommend",
  "record_id": "sha256:ff6afc447d296026e603a048b2d9c38278a950b4208fde8979bae99800cb8fbf",
  "rollback_ref": "sha256:0000000000000000000000000000000000000000000000000000000000000000"
}
